date,eventType,eventLabel,amount,currency,notes,sourceUrl
2017-05-31,Borrowing,Inaugural international sovereign bond issued/listed,200000000,USD,"5-year maturity, 7% coupon. Finance Ministry says the issue was oversubscribed by double and rated B2 by Moody's and B+ by Fitch.",https://www.finance.gov.mv/media/news/international-sovereign-bond-issuance-for-the-maldives
2021-03-29,Borrowing,Debut sovereign Sukuk priced,200000000,USD,"5-year Sukuk, 9.875% semi-annual coupon, proceeds used to settle tender offers for 2022 bonds.",https://icd-ps.org/en/news/the-republic-of-maldives-successfully-prices-its-debut-sovereign-us200-million-5-year-sukuk-issuance
2021-09-02,Borrowing,Sukuk tap issuance takes 2021 Sukuk total to USD 500m,200000000,USD,"Additional USD 200m Sukuk after March and April 2021 issuance, taking total to USD 500m.",https://mfr.mv/debt/maldives-sukuk-reaches-usd500-million
2022-06-07,Repayment,Outstanding debut Eurobond balance repaid,58030000,USD,Government repaid outstanding USD 58.03m of debut USD 250m Eurobond after earlier refinancing of USD 191.97m.,https://corporatemaldives.com/maldives-retires-its-debut-eurobond-issued-to-the-international-market-on-maturity/
2024-06-26,Debt pressure marker,Fitch flags 2026 external debt service risk,,USD,"Fitch downgrade cited large external refinancing hurdles in 2025 and 2026, including the USD 500m Sukuk repayment.",https://mvrepublic.com/news/fitch-downgrades-maldives-rating-from-b-to-ccc-citing-worsening-external-financing/
2026-04-02,Repayment,USD 500m Sukuk settled,524680000,USD,Government settled USD 500m principal and USD 24.68m coupon using the Sovereign Development Fund and other foreign currency balances.,https://www.finance.gov.mv/media/press-releases/press-release-settlement-of-usd-500-million-sukuk
2026-06-03,Rating follow-through,Fitch upgrades Maldives after Sukuk repayment,,USD,"Fitch upgraded Maldives to CCC- from CC, citing eased default risks following successful Sukuk repayment.",https://www.fitchratings.com/research/sovereigns/fitch-upgrades-maldives-to-ccc-03-06-2026
